{
  "artifact_id": "docs.fractal-ontology",
  "title": "Fractal Ontology",
  "artifact_type": "concept_node",
  "parent": "docs",
  "concept": "fractal ontology",
  "status": "draft",
  "version": "0.2.0",
  "created_at": "2026-03-27",
  "updated_at": "2026-04-08",
  "summary": "Concept-node metadata for recursive relationship logic and semantic continuity across levels.",
  "author": {
    "name": "Lowell T. Wong",
    "role": "author"
  },
  "scope": [
    "recursive relationship logic",
    "semantic continuity across levels",
    "dependency structures",
    "context-preserving meaning"
  ],
  "related_concepts": [
    "fractal taxonomy",
    "fractal decision-making",
    "machine-readable artifact design",
    "knowledge graphs",
    "semantic networks"
  ],
  "source_docs": [
    "docs/fractal-ontology/README.md",
    "docs/fractal-ontology/notes-v1.md",
    "docs/fractal-ontology/lineage.md"
  ]
}
