{
  "artifact_id": "docs.fractal-taxonomy",
  "title": "Fractal Taxonomy",
  "artifact_type": "concept_node",
  "parent": "docs",
  "concept": "fractal taxonomy",
  "status": "draft",
  "version": "0.2.0",
  "created_at": "2026-03-27",
  "updated_at": "2026-04-08",
  "summary": "Concept-node metadata for recursive classification logic and stable field families that recur across scales.",
  "author": {
    "name": "Lowell T. Wong",
    "role": "author"
  },
  "scope": [
    "recursive classification logic",
    "stable field families",
    "multi-level structure",
    "inheritance-aware categorization"
  ],
  "related_concepts": [
    "fractal ontology",
    "fractal decision-making",
    "machine-readable artifact design",
    "recursive governance",
    "hierarchical representation"
  ],
  "source_docs": [
    "docs/fractal-taxonomy/README.md",
    "docs/fractal-taxonomy/notes-v1.md",
    "docs/fractal-taxonomy/lineage.md"
  ]
}
