{
  "artifact_id": "docs.integrations",
  "title": "Integrations",
  "artifact_type": "concept_node",
  "parent": "docs",
  "concept": "integrations",
  "status": "draft",
  "version": "0.2.0",
  "created_at": "2026-03-27",
  "updated_at": "2026-04-08",
  "summary": "Concept-node metadata for system-level synthesis, crosswalks, anchors, tags, and machine-readable integration logic.",
  "author": {
    "name": "Lowell T. Wong",
    "role": "author"
  },
  "scope": [
    "concept crosswalks",
    "system-level synthesis",
    "machine-readable artifact design",
    "artifact anchors and tags",
    "fractal artifact naming",
    "sequence and dependency logic"
  ],
  "related_concepts": [
    "AIRCA",
    "UAIRCA",
    "LAIRCA",
    "fractal taxonomy",
    "fractal ontology",
    "fractal decision-making",
    "machine-readable artifact design",
    "recursive governance",
    "artifact lifecycle",
    "inheritance logic",
    "interpretation rules",
    "decision ledger",
    "ultimate frame",
    "Logos",
    "theological decision architecture",
    "theology and machine decision systems",
    "theological governance",
    "moral anthropology",
    "faith-grounded AI governance",
    "Christian AI ethics",
    "Christian AI governance",
    "AI and theology",
    "AI and Christianity",
    "biblical decision-making",
    "Christian decision architecture",
    "knowledge graphs",
    "decision intelligence"
  ],
  "source_docs": [
    "docs/integrations/README.md",
    "docs/integrations/notes-v1.md",
    "docs/integrations/lineage.md",
    "docs/integrations/example-machine-readable-artifact.md",
    "docs/integrations/machine-readable-artifact-anchors-and-tags.md",
    "docs/integrations/fractal-artifact-class-naming.md"
  ]
}
