{
  "artifact_id": "docs.airca",
  "title": "AIRCA",
  "artifact_type": "concept_node",
  "parent": "docs",
  "concept": "AIRCA",
  "status": "draft",
  "version": "0.2.0",
  "created_at": "2026-03-27",
  "updated_at": "2026-04-08",
  "summary": "Concept-node metadata for AIRCA, UAIRCA, and LAIRCA as the decision spine and its higher-order extensions.",
  "author": {
    "name": "Lowell T. Wong",
    "role": "author"
  },
  "attribution": {
    "collaborative_emergence": true,
    "collaborators": [
      "Alex A.",
      "Lowell T. Wong"
    ],
    "repository_extension_by": "Lowell T. Wong",
    "uairca_extension_by": "Lowell T. Wong",
    "lairca_extension_by": "Lowell T. Wong"
  },
  "scope": [
    "AI-era adaptation of RACI",
    "decision architecture",
    "human judgment under AI-assisted overload",
    "decision spine across levels",
    "UAIRCA ultimate-frame extension",
    "LAIRCA Logos-grounded Christian expression"
  ],
  "related_concepts": [
    "fractal taxonomy",
    "fractal ontology",
    "fractal decision-making",
    "machine-readable artifact design",
    "recursive governance",
    "UAIRCA",
    "LAIRCA",
    "Ultimate Frame",
    "Logos"
  ],
  "source_docs": [
    "docs/airca/README.md",
    "docs/airca/notes-v1.md",
    "docs/airca/uairca-notes-v1.md",
    "docs/airca/lairca-notes-v1.md",
    "docs/airca/lineage.md"
  ]
}
